" And finally, I ’ll place today ’s policy decision in the context of our economic projections and our assessments of the appropriate path  of monetary policy ."
" And the second question is related also to inflation January 25, 2012  Chairman Bernanke’s Press Conference  FINAL    27 of 29 and to the targeting because  the Fed’s always been a little bit vague in terms of what sort of inflation it w ould accept , and this is a marked  change ."
" One is , it reduces the share of the inflation index  which is tied to housing ."
 So I think this is probably a better measure of the inflation that ’s faced by typical consumers than the CPI is .
" So, in that respect, I think if people look at the CPI, they should feel pretty comfortable that, you know, that ’s going to be very close to where the PCE inflation is ."
" And now , it’s true , as has been pointed out , that for the moment interest rates are pretty low , but they ’re still positive ."
" But over a longer period of time , if you —even if you have money in a CD or some other investment vehicle, the interest rate will compensate you for inflation."
" And so the re really shouldn’ t be, you know —at levels of inflation this low , interest rate s should pretty much fully compensate for the losses to savers ."
" But I would reiterate that  we are not unaware of the problems that low interest rates cause for savers, cause for pension fund contributions , insurance companies , and other parts of the economy , and we do try to take that into account as we think about other ramifications of our policy ."
