"  We also know  that the burdens of a weak econ omy and the benefits of economic growth  often are not equally shared, and that, to be truly effective,  policymakers must take into account how their decisions affect the least advantaged, not just the economy as a whole."
" The growing demand for homes has been  underpinned by record levels of affordability, the result of  historically low mortgage rates and  house prices that are 30 percent or more below their peaks in many areas ."
"- 5 -    To be clear , the reduction  in mortgage  originations  and home purchases  for all groups  relative to the pre -crisis period partly reflects weakness in the effective demand for housing  rather than the unavailability of mortgage credit ."
" Unemployment , income loss, and income insecurity  prevent  many  households from purchasing homes , and concerns about the future direction of the labor market, housing prices, and the economy more generally keep other  potential buyers  on the sidelines ."
"  For example, a number of public and private efforts have been made to help avoid unnecessary foreclosures  and to enable  underwater  and other  borrowers to refinance at lower interest rates."
" Obviously, loss o f employment or income  makes it more difficult for families to pay their mortgages, maintain good credit histories , refinance their mortgages at lower rates, and avoid foreclosure."
" Low interest rates reduce the cost to households of buying homes, cars, and other consumer durables while increasing the attractiveness of new capital investments by firms."
 Increased demand in turn leads to faster economic growth  and more jobs.
 My colleagues and I have been and remain  quite  concerned about  the stubbornly  high level of unemployment --particularly long -term unemployment .
" In September, we took the added step of stating that we will continue actions to put downward pressure on long erterm interest rates until the outlook for the job market improves substantially in a context of price stabilit y."
" Some of the skills that prospective homeowners need are relatively basic --for example , knowing how to shop for the lowest interest rate  and fees , understanding the difference between a fixed -rate and an adjustable -rate mortgage, and , very importantly , knowing  how to find trustworthy information and advice."
"” The Federal Reserve will continue to  do what we can to  support the housing recovery , both  through our monetary policy and our regulatory and supervisory actions."
