" This correlation holds even after controlling for othe r county characteristics, such as changes in unemployment, changes in population, and changes in violent crime.8    In turn, blight and crime make these neighborhoods less attractive to potential buyers, renters, and businesses."
"- 6 -   The second category of high longterm vacancy  census tract has a large share of older housing stock built before 1960, low median inco me, a high poverty rate, a high unemployment rate, and a large share of resident s with less than a high school degr ee."
 These tracts can be called “low demand” locations because these characteristics are freque ntly associated with areas suffering from persistent job loss and a declin e in housing demand.
" Phoenix was one of the areas hit hard during th e housing bust, with a peakto-trough decline in prices  of more than 50 percent.14  More recently, however, prices in Phoenix have rebounded with a doubledigit in crease over the 12 months ending in July.15  Reportedly, much of this demand is driven by investors who are converting vacant homes into rental properties."
"        “Low Demand” Locations Not all markets are equally at tractive to private investors, so some governments are developing programs to attract pr ivate capital to “low demand ,” highvacancy neighborhoods."
"  But even though the vacancy rates in Oklahoma City are not a direct  result of the housing boom and bust, it may be that newer solutions developed for “housing boom” and “low demand” areas can be combined with tr aditional community development policy tools to help solve a problem that developed over decades."
" Increasing costs for needed city services, reduced revenues, and barr iers to growth resulting from deteriorating infrastructure all combined to lend urgency to thes e efforts."
