" On a closely related issue concerning evidence that investors’ perceptions of the likelihood of high inflation versus low inflation have shifted noticeably in                                                   - 16 - A final argument for gradual ly adjusting policy relates to the desirability of achieving a prompt return of inflation to the FOMC’s 2 percent goal, an objective that would be advanced by allowing the unemployment rate to decline for a time somewhat below estimates of its longer -run sustainable level."
" Proceeding too slowly to tighten policy could have adverse consequences for the attainment of the Committee ’s inflation objective over time, especiall y if it were to undermine the FOMC ’s inflation credibility."
" Inflation could, for example, exhibit nonlinear dynamics in which high levels of unemployment place relatively little downward pressure on inflation, but tight labor markets generate marked upwar d pressure."
" If so, a decline in unemployment recent months, see Justin Wolfers (2015), “A Prediction Market for Inflation, or Deflation,” The Upshot , New York Times,  March 6."
"Wright (2013), “The Economics of Options -Implied Inflation Probability Density Functions,” Journal of Financial Economics , vol."
"15 For a discussion of these effects, see Dav e Reifschneider, William  Wascher, and David Wilcox (2015 ), “Aggregate Supply in the United States:  Recent Developments and Implications for the Conduct of Monetary Policy,” IMF Economic Review  advance  online publication, March 17, doi: 10.1057/imfer.2015.1 ."
                                                  - 17 - below its natural rate could cause inflation to quickly rise to an undesirably  high level.
" Rapid increases in short -term interest rates to arrest such an unwelcome development could, in turn, have adverse effe cts on financial markets and the broader economy."
" We cannot be certain about the underlying strength of the expansion, the maximum level of employment consistent with price stability , or the longer -run level of interest rates consistent with 16 Jeremy C."
"Yellen (2014), “Semiannual Monetary Policy Report to the Congress,” testimony before the Committee on Banking, Housing, and Urban Affairs, U.S. Senate, July 15, www.federalreserve.gov/newsevents/testimony/yellen20140715a.htm ."
"Yellen, (2014) “Monetary Policy and Financial Stability,” speech delivered at the 2014 Michel Camdessus Cent ral Banking Lecture, International Monetary Fund, Washington, July 2, www.federalreserve.gov/newsevents/speech/yellen20140702a.htm ."
                                                  - 18 - maximum employment.
 Nothing about the course of the Committee’s actions is predetermined except the Committee’s commitment to promote our dual mandate of maximum employment and price stabi lity.
