" Summary of Economic Projections of the Meeting of September 1617, 2015Page 13_____________________________________________________________________________________________        Forecast Uncertainty     The economic projections provided by the members of the Board of Governors and the presidents of the Federal Reserve Banks inform discussions of monetary policy among policymakers and can aid public understanding of the basis for policy actions."
" Thus, in setting the stance of monetary policy, participants consider not only what appears to be the most likely economic outcome as embodied in their projections, but also the range  of alternative possibilities, the likelihood of their occurring, and the potential costs to the economy should they occur."
"Table 2 summarizes the average historical accuracy of a range of forecasts, including those reported in past Monetary Policy Report s and those prepared by the Federal Reserve Board’s staff in advance of meetings of the Federal Open Market Committee."
" The corresponding 70  percent confidence intervals for overall inflation would be 1.2  to 2.8  percent in the current year, 1.0  to 3.0  percent in the second year, 0.9  to 3.1  percent in the third year, and 1.0 to 3.0  percent in the fourth year."
" As with real activity and inflation, the outlook for the future path of the federal funds rate is subject to considerable uncertainty."
 This uncertainty arises primarily because each participant’s assessment of the appropriate stance of monetary policy depends importantly on the evolution of real activity and inflation over time.
