"In determining the timing and size of future adjustments to the target range for the federal funds rate, the Committee will assess realized and expected economic conditions relative to its objectives of maximum employment and 2 percent inflation."
" Th is assessment will take into account a wide range of information, including measures of labor market conditions, indicators of inflation pressures and inflation expectations, and readings on financial and international developments."
" In light of the current shortfall of inflation from 2 percent, the Committee will carefully monitor actual and expected progress toward its inflation goal."
"Madigan SecretaryPage 12 Federal Open Market Committee____________________________________________________________________________________________ _Summary of Economic Projections  In conjunction with the Federal Open Market Committee (FOMC) meeting held on June 14–15, 2016, meeting participants submitted their projections of the most likely outcomes for real output growth, the unemployment rate, inflation, and the federal funds rate for each year from 2016 to 2018 and over the longer run.1  Each participant’s projection was based on information available at the time of the meeting, together with his or her assessment of appropriate monetary policy and assumptions about the factors likely to affect economic outcomes."
" The longerrun proj ections represent each participant’s assessment of the value to which each variable would be expected to converge, over time, under appropriate monetary policy and in the absence of further shocks to the economy."
 “A ppropriate monetary policy” is defined as the future path of policy that each participant deems most likely to fo ster outcomes for economic activity and inflation that best satisfy his or her individual interpretation of the Federa l Reserve’s objectives of maximum employment and stable prices.
"FOMC participants generally expected that, under appropriate monetary policy, grow th in real gross domestic product (GDP) this year, next year, and in 2018 would be at or quite close to their individual estimates of GDP growth over the longer run."
 All but a few participants projected that the unemployment  rate at the end of this year will be at or below its longerrun normal rate and expected it to edge lower ne xt year.
" Almost all participants projected that inflation, as measured by the fourquarter percentage change in the pr ice index for personal consumption expenditures (PCE), would increase this year and over the next two years, and most expected inflation to have converged to the Committee’s objective of 2 percent by 2018."
"As shown in figure 2, almost all participants expected that it would be appropriate for the target range for the federal funds rate to rise gradually as the economy steadily progresses toward the Committee’s longerrun goals of maximum employment and 2 percent inflation."
"Participants generally viewed the level of uncertainty associated with their individual forecasts for economic growth, unemployment, and inflation as broadly similar to the norms of the previous 20 years."
" Most participants also judged the risks around their projections for economic activity and inflatio n as broadly balanced, although many participants saw the risks to their GDP growth and inflation forecasts as weighted to the downside."
"The Outlook for Economic Activity The median of participants’ projections for the growth rate of real GDP, conditio nal on their individual assumptions about appropriat e monetary policy, was 2 percent for each year from 2016 through 2018, the same as the median of their projections of the longerrun GDP growth rate."
" However, a majority of participants expected that real GDP growth would pick up a bit in 2017 from this year’s pace, and most expected it to remain at or above their esti mates of its longerrun pace in 2018."
" Participants pointed to a number of factors that they expected would contribute to moderate output growth over the next few years, including a diminution of the drag on net exports from a strong dollar, the continued improvements in hou sehold and business balance sheets, accommodative financ ial conditions, and somewhat more supportive fiscal policy."
Participants’ median projecti ons for real GDP growth in 2016 and 2017 were slightly lower than the medians shown in the March 2016 Su mmary of Economic Projections (SEP).
" Participants who lowered their projections for nearterm GDP grow th generally attributed their revisions to weakerthan-expected growth in the first quarter and soft readin gs on economic activity in recent months, particularly t hose on business spending."
" Although several participants also reduced their forecasts for real GDP growth in 2018 and in the longer run, Page 1 ____________________________________________________________________________________________ _Table 1."
"Economic projections of Federal Reserve Board members and Federal Reserve Bank presidents,under their individual assessments of projected appropriate monetary policy, June 2016PercentVariableMedian1Central tendency2Range32016 2017 2018 Longerrun2016 2017 2018 Longerrun2016 2017 2018 LongerrunChange in real GDP 2.0 2.0 2.0 2.0 1.9 – 2.0 1.9 – 2.2 1.8 – 2.1 1.8 – 2.0 1.8 – 2.2 1.6 – 2.4 1.5 – 2.2 1.6 – 2.4March projection 2.2 2.1 2.0 2.0 2.1 – 2.3 2.0 – 2.3 1.8 – 2.1 1.8 – 2.1 1.9 – 2.5 1.7 – 2.3 1.8 – 2.3 1.8 – 2.4Unemployment rate 4.7 4.6 4.6 4.8 4.6 – 4.8 4.5 – 4.7 4.4 – 4.8 4.7 – 5.0 4.5 – 4.9 4.3 – 4.8 4.3 – 5.0 4.6 – 5.0March projection 4.7 4.6 4.5 4.8 4.6 – 4.8 4.5 – 4.7 4.5 – 5.0 4.7 – 5.0 4.5 – 4.9 4.3 – 4.9 4.3 – 5.0 4.7 – 5.8PCE inﬂation 1.4 1.9 2.0 2.0 1.3 – 1.7 1.7 – 2.0 1.9 – 2.0 2.0 1.3 – 2.0 1.6 – 2.0 1.8 – 2.1 2.0March projection 1.2 1.9 2.0 2.0 1.0 – 1.6 1.7 – 2.0 1.9 – 2.0 2.0 1.0 – 1.6 1.6 – 2.0 1.8 – 2.0 2.0Core PCE inﬂation41.7 1.9 2.0 1.6 – 1.8 1.7 – 2.0 1.9 – 2.0 1.3 – 2.0 1.6 – 2.0 1.8 – 2.1March projection 1.6 1.8 2.0 1.4 – 1.7 1.7 – 2.0 1.9 – 2.0 1.4 – 2.1 1.6 – 2.0 1.8 – 2.0Memo: Projectedappropriate policy pathFederal funds rate 0.9 1.6 2.4 3.0 0.6 – 0.9 1.4 – 1.9 2.1 – 2.9 3.0 – 3.3 0.6 – 1.4 0.6 – 2.4 0.6 – 3.4 2.8 – 3.8March projection 0.9 1.9 3.0 3.3 0.9 – 1.4 1.6 – 2.4 2.5 – 3.3 3.0 – 3.5 0.6 – 1.4 1.6 – 2.8 2.1 – 3.9 3.0 – 4.0Note: Projections of change in real gross domestic product (GDP) and projections for both measures of inﬂation are percent changes from thefourth quarter of the previous year to the fourth quarter of the year indicated."
Projections forthe unemployment rate are for the average civilian unemployment rate in the fourth quarter of the year indicated.
Each participant’s projections arebased on his or her assessment of appropriate monetary policy.
Longerrun projections represent each participant’s assessment of the rate to which e achvariable would be expected to converge under appropriate monetary policy and in the absence of further shocks to the economy.
"Medians, central tendencies, and ranges of economic projections, 2016–18 and over the longer runChange in real GDPPercent1232011 2012 2013 2014 2015 2016 2017 2018 LongerrunCentral tendency of projectionsRange of projectionsMedian of projectionsActualUnemployment ratePercent4567892011 2012 2013 2014 2015 2016 2017 2018 LongerrunPCE inflationPercent1232011 2012 2013 2014 2015 2016 2017 2018 LongerrunCore PCE inflationPercent1232011 2012 2013 2014 2015 2016 2017 2018 LongerrunNote: Deﬁnitions of variables and other explanations are in the notes to table 1."
FOMC participants’ assessments of appropriate monetary policy: Midpoint of target range or target level forthe federal funds ratePercent0.00.51.01.52.02.53.03.54.04.55.02016 2017 2018 Longer runNote: Each shaded circle indicates the value (rounded to the nearest 1/8percentage point) of an individual participant’s judgment of the midpoint of the appropriate target range for the federal funds rate or the appropriate targetlevel for the federal funds rate at the end of the speciﬁed calendar year or over the longer run.
"The median of projections for the unemployment rate edged down from 4.7 percent at the end of 2016 to 4.6 percent in 2017 and remained at that level in 2018, modestly below the median assessment of the longerrun normal unemployment rate of 4.8 percent."
Figures 3.A and 3.B show th e distributions of participants’ projections for real GDP growth and the unemployment rate from 2016 through 2018 and in the longer run.
 The distribution of individual projections of GDP growth for 2016 shifted lower relative to the distribution of the March projections.
 The distributions of projections for GDP growth over the next two years and in the longer run also shifted down.
" For this year and next, the distributions of projections for the unemployment rate were little changed, while the distribution for 2018 became less dispersed."
"The Outlook for Inflation In the June SEP, the median of projections for headline PCE price inflation in 2016 was 1.4 percent, a bit higher than in March."
" Many partic ipants pointed to strongerthan-expected readings on inflation early this year, as well as to the recent stabilizat ion of oil prices, as factors contributing to the upward revision to their inflation projections."
" The projections for headline PCE price inflation over the next two years  and in the longer run were little changed since March, with the median inflation projection still rising to 1.9 percent in 2017 and to the Committee’s objective of 2 percent in 2018."
 Almost all participants projected that inflation will be within 0.1 percentage point of the Committee’s objective by 2018.
 The median of individual projections for core PCE price inflation also increases gradually over the next two years.
  Figures 3.C and 3.D provide information on the distribution of participants’ views about the outlook for inflation.
 The distribution of projections for headline PCE price inflation for this year sh ifted up relative to projections for the March meeting.
" The distribution of projections for core PCE price inflation this year also moved 2 One participant’s projections for the federal funds rate, GDP growth, the unemployment rate, and inflation were informed by the view that there are mult iple possible mediumterm regimes for the U.S. economy, that these regimes are persistent, and that the economy shifts between regimes in a way that   to the right on balance."
" For 2017 and 2018, the distributions of projections for bo th total and core PCE price inflation were nearly unchanged."
Appropriate Monetary Policy Figure 3.E provides the dist ribution of participants’ judgments regarding the appropriate level of the target federal funds rate at the end of each year from 2016 to 2018 and over the longer run.2  The distributions for 2016 to 2018 and for the longer run shifted to the left.
"Participants’ projections for the path of the federal funds rate represented their individual assessments of appropriate monetary policy consistent with their projections of economic growth, employment, inflation, and other factors."
" In discussing their June forecasts, many participants expressed a view that increases in the federal funds rate over the next several years would need to be gradual in light of a shortterm neutral interest rate that was currently low—a phenomenon that several participants attributed to the persistence of factors that restrained spending over recent years—and that was likely to rise only slowly as the effects of those factors faded over time."
 Some participants noted the proximity of shortterm nominal interest rates to the effective lower bound as limiting the Committee’s ab ility to increase monetary accommodation to counter adverse shocks to the economy should they occur.
" Under this view, the economy currently is in a regime characterized by expansion of economic activity with low productivity growth and a low shortterm real interest rate, but longerterm outcomes cannot be usefully projected."
"Summary of Economic Pro jections of the Meeting of June 14–15, 2016 Page 5 ____________________________________________________________________________________________ _Figure 3.A. Distribution of participants’ projections for the change in real GDP, 2016–18 and over the longer run2016Number of participants246810121416181.4 1.6 1.8 2.0 2.2 2.4   -  -  -  -  -  -1.5 1.7 1.9 2.1 2.3 2.5 Percent rangeJune projectionsMarch projections2017Number of participants246810121416181.4 1.6 1.8 2.0 2.2 2.4   -  -  -  -  -  -1.5 1.7 1.9 2.1 2.3 2.5 Percent range2018Number of participants246810121416181.4 1.6 1.8 2.0 2.2 2.4   -  -  -  -  -  -1.5 1.7 1.9 2.1 2.3 2.5 Percent rangeLonger runNumber of participants246810121416181.4 1.6 1.8 2.0 2.2 2.4   -  -  -  -  -  -1.5 1.7 1.9 2.1 2.3 2.5 Percent rangeNote: Deﬁnitions of variables and other explanations are in the notes to table 1.Page 6 Federal Open Market Committee____________________________________________________________________________________________ _Figure 3.B. Distribution of participants’ projections for the unemployment rate, 2016–18 and over the longer run2016Number of participants246810121416184.2 4.4 4.6 4.8 5.0 5.2 5.4 5.6 5.8   -   -   -   -   -   -   -   -   -4.3 4.5 4.7 4.9 5.1 5.3 5.5 5.7 5.9 Percent rangeJune projectionsMarch projections2017Number of participants246810121416184.2 4.4 4.6 4.8 5.0 5.2 5.4 5.6 5.8   -   -   -   -   -   -   -   -   -4.3 4.5 4.7 4.9 5.1 5.3 5.5 5.7 5.9 Percent range2018Number of participants246810121416184.2 4.4 4.6 4.8 5.0 5.2 5.4 5.6 5.8   -   -   -   -   -   -   -   -   -4.3 4.5 4.7 4.9 5.1 5.3 5.5 5.7 5.9 Percent rangeLonger runNumber of participants246810121416184.2 4.4 4.6 4.8 5.0 5.2 5.4 5.6 5.8   -   -   -   -   -   -   -   -   -4.3 4.5 4.7 4.9 5.1 5.3 5.5 5.7 5.9 Percent rangeNote: Deﬁnitions of variables and other explanations are in the notes to table 1.Summary of Economic Pro jections of the Meeting of June 14–15, 2016 Page 7 ____________________________________________________________________________________________ _Figure 3.C. Distribution of participants’ projections for PCE inﬂation, 2016–18 and over the longer run2016Number of participants246810121416180.9 1.1 1.3 1.5 1.7 1.9 2.1   -  -  -  -  -  -  -1.0 1.2 1.4 1.6 1.8 2.0 2.2 Percent rangeJune projectionsMarch projections2017Number of participants246810121416180.9 1.1 1.3 1.5 1.7 1.9 2.1   -  -  -  -  -  -  -1.0 1.2 1.4 1.6 1.8 2.0 2.2 Percent range2018Number of participants246810121416180.9 1.1 1.3 1.5 1.7 1.9 2.1   -  -  -  -  -  -  -1.0 1.2 1.4 1.6 1.8 2.0 2.2 Percent rangeLonger runNumber of participants246810121416180.9 1.1 1.3 1.5 1.7 1.9 2.1   -  -  -  -  -  -  -1.0 1.2 1.4 1.6 1.8 2.0 2.2 Percent rangeNote: Deﬁnitions of variables and other explanations are in the notes to table 1.Page 8 Federal Open Market Committee____________________________________________________________________________________________ _Figure 3.D. Distribution of participants’ projections for core PCE inﬂation, 2016–182016Number of participants246810121416181.3 1.5 1.7 1.9 2.1   -   -   -   -   -1.4 1.6 1.8 2.0 2.2 Percent rangeJune projectionsMarch projections2017Number of participants246810121416181.3 1.5 1.7 1.9 2.1   -   -   -   -   -1.4 1.6 1.8 2.0 2.2 Percent range2018Number of participants246810121416181.3 1.5 1.7 1.9 2.1   -   -   -   -   -1.4 1.6 1.8 2.0 2.2 Percent rangeNote: Deﬁnitions of variables and other explanations are in the notes to table 1.Summary of Economic Pro jections of the Meeting of June 14–15, 2016 Page 9 ____________________________________________________________________________________________ _Figure 3.E. Distribution of participants’ judgments of the midpoint of the appropriate target range for the federal fundsrate or the appropriate target level for the federal funds rate, 2016–18 and over the longer run2016Number of participants246810121416180.63 0.88 1.13 1.38 1.63 1.88 2.13 2.38 2.63 2.88 3.13 3.38 3.63 3.88    -    -    -    -    -    -    -    -    -    -    -    -    -    -0.87 1.12 1.37 1.62 1.87 2.12 2.37 2.62 2.87 3.12 3.37 3.62 3.87 4.12 Percent rangeJune projectionsMarch projections2017Number of participants246810121416180.63 0.88 1.13 1.38 1.63 1.88 2.13 2.38 2.63 2.88 3.13 3.38 3.63 3.88    -    -    -    -    -    -    -    -    -    -    -    -    -    -0.87 1.12 1.37 1.62 1.87 2.12 2.37 2.62 2.87 3.12 3.37 3.62 3.87 4.12 Percent range2018Number of participants246810121416180.63 0.88 1.13 1.38 1.63 1.88 2.13 2.38 2.63 2.88 3.13 3.38 3.63 3.88    -    -    -    -    -    -    -    -    -    -    -    -    -    -0.87 1.12 1.37 1.62 1.87 2.12 2.37 2.62 2.87 3.12 3.37 3.62 3.87 4.12 Percent rangeLonger runNumber of participants246810121416180.63 0.88 1.13 1.38 1.63 1.88 2.13 2.38 2.63 2.88 3.13 3.38 3.63 3.88    -    -    -    -    -    -    -    -    -    -    -    -    -    -0.87 1.12 1.37 1.62 1.87 2.12 2.37 2.62 2.87 3.12 3.37 3.62 3.87 4.12 Percent rangeNote: The midpoints of the target ranges for the federal funds rate and the target levels for the federal funds rateare measured at the end of the speciﬁed calendar year or over the longer run."
" Particip ants cited a number of factors that pushed down their projections of the longerrun rate, including domest ic and global demographic trends and weak productivity growth, which together imply a slower pace of trend output growth."
"Uncertainty and Risks  The lefthand column of figure 4 shows that all but a few participants judged the levels of uncertainty around their June projections for real GDP growth, the unemployment rate, and headline and core PCE price inflation to be broadly similar to the average levels of the past 20 years.3  A few participants saw the uncertainty about G D P  g r o w t h  a s  h i g h e r  t h a n  i t s  h i s t o r i c a l  a v e r a g e ,  u p  from only one in March."
 Th ese participants cited the surprisingly weak productivity  growth of recent years or the continuing fragile nature of the global economic environment as supporting such a view.
"As in March, most participants judged the risks to their projections of GDP growth and the unemployment rate to be broadly balanced, althou gh many still assessed the risks to GDP growth as weighted to the downside and some saw the risks to the unemployment rate as tilted to the upside (top two panels in the righthand column of figure 4)."
" Participants who saw the risks to growth as tilted to the downside attributed this assessment to the weakerthan-expected May employment report; recent softness in business fixed investment; concerns about the global economic environment, including possible economic and financial consequences of the upcoming British referendum on European Union membership; or the proximity of shortterm nominal interest rates to the effective lower bound."
 A majority of participants judged the risks to their inflation pr ojections to be broadly balanced.
" However, many viewed the risks to inflation as skewed to the downside, although fewer than in March."
 A couple of participants pointed to the firming of some measures of inflation in recent months as contributing to the change in their risk assessment.
" Among those who continued to judge that the risks to inflation were weighted to the downside, almost all cited recent declines in measures of inflation compensation and some surveybased measures of longerrun inflation expectations as reasons for that assessment."
"   3 Table 2 provides estimates of the forecast uncertainty for the change in real GDP, the unemployment rate, and total consumer price inflation over the period from 1996 through 2015."
 ±1.4 ±2.0 ±2.2 Unemployment rate1 .
" As described in the box “Forecast Uncertainty,” under certain assumptions, there is about a 70 percent probability that actual outcomes for real GDP, unemployment, and consumer prices will be in ranges implied by the average size of projection errors made in the past."
"Uncertainty and risks in economic projectionsUncertainty about GDP growthNumber of participants24681012141618Lower Broadly HighersimilarJune projectionsMarch projectionsUncertainty about the unemployment rateNumber of participants24681012141618Lower Broadly HighersimilarUncertainty about PCE inflationNumber of participants24681012141618Lower Broadly HighersimilarUncertainty about core PCE inflationNumber of participants24681012141618Lower Broadly HighersimilarRisks to GDP growthNumber of participants24681012141618Weighted to Broadly Weighted todownside balanced upsideJune projectionsMarch projectionsRisks to the unemployment rateNumber of participants24681012141618Weighted to Broadly Weighted todownside balanced upsideRisks to PCE inflationNumber of participants24681012141618Weighted to Broadly Weighted todownside balanced upsideRisks to core PCE inflationNumber of participants24681012141618Weighted to Broadly Weighted todownside balanced upsideNote: For deﬁnitions of uncertainty and risks in economic projections, see the box “Forecast Uncertainty.” Deﬁnitions of variables are in the notes to table 1.Page 12 Federal Open Market Committee____________________________________________________________________________________________ _  Forecast Uncertainty  The economic projections provided by the members of the Board of Governors and the presidents of the Federal Reserve Banks inform discussions of monetary policy among policymakers and can aid public unders tanding of the basis for policy actions."
"Table 2 summarizes the average historical accuracy of a range of forecasts, including those reported in past Monetary Policy Report s and those prepared by the Federal Reserve Board’s staff in advance of meetings of the Federal Open Market Committee."
 The corresponding 70 percent confidence intervals for overall inflation would be 1.2 to 2.8 percent in the current year and 1.0 to 3.0 percent in the second and third years.
"As with real activity and inflation, the outlook for the future path of the federal funds rate is subject to considerable uncertainty."
 This uncertainty arises primarily because ea ch participant’s assessment of the appropriate stance of monetary policy depends importantly on the evolution of real activity and inflation over time.
