" Daily takeup in the Desk’s overnight reverse repurchase agreement operations declined somewhat, apart from month -ends, likely reflecting some increase in money market interest rates."
" However, if substantial adverse shocks occurred , continuing reinvestment until normalization of the level of the federal funds rate was well under way could help avoid situations that would warrant a larger reduction in the federal funds rate than perhaps could be accomplished given the constraint posed by the effective lower bound to nominal interest rates."
" At the same time, it was also highlighted that a larger balance sheet could entail costs, and that the Principles and Plans indicate that, in the longer run, the SOMA portfolio should be no larger than necPage 2Federal Open Market Committee_____________________________________________________________________________________________essary to conduct monetary policy efficiently and effectively."
 Consumer price inflation remained below the Committee’s longer -run objective of 2 percent and was restrained by further declines in energy prices and non -energy import prices.
" Survey measures of longer -run inflation expectatio ns remained stable, while market -based measures of inflation compensation moved lower."
 Total nonfarm payroll employment expanded at a solid pace in July and August.
 The unemployment rate stayed at 5.3 percent in July but fell to 5.1 percent in August.
" With the labor force participation rate unchanged over this period, the employmentto-population ratio edged up."
 Household spending was supported by moderate growth in real disposable income in July and a wealth -toincome ratio that remained high even after recent declines in equity values.
 The U.S. international trade deficit widened in June before narrowing substantially in July.
" Measures of expected longer -run inflation from a variety of surveys, including the Michigan survey, Minutes of the Meeting of September 1617, 2015Page 3_____________________________________________________________________________________________the Survey of Professional Forecasters, and the Desk’s Survey of  Primary Dealers, remained stable."
" However, market -based measures of inflation compensation fell to near their historical lows , reportedly  in response to the recent appreciation of the dollar, the decline in oil prices, and readings on realized inflation that were slightly below market expectations."
" Over the four quarters ending in the second quarter, the employment cost index increased nearly 2 percent and compensation per hour in the nonfarm business sector rose 2¼ percent."
" Foreign eco nomic growth remained weak in the second quarter, held back by contractions in real GDP in Canada, Japan, Brazil, and Taiwan, even as activity continued to expand at a moderate pace in the euro area and the United Kingdom."
" Indicators for the third quarter  pointed to a slight pickup in the pace of foreign growth, particularly as recent data for Canada suggested that some of the firsthalf weakness there was dissipating."
" Inflation rates continued to be quite low in the advanced foreign economies, and market -based measures of inflation compensation had recently moved down in the euro area and Japan."
" In contrast, inflation in the emerging market economies had risen in recent months as a result of higher food prices and widespread currency depreciation."
"Staff Review of the Financial Situation  Although U.S. economic data releases generally met market expectations, domestic financial conditions tightened modestly as concerns a bout prospects for  global economic growth, centered  on China, prompted an increase in financial market volatility and a deterioration in risk sentiment during the intermeeting period."
" Over the intermeeting period, t he concerns about global economic growth and turbulence in financial markets  led to greater uncertainty among market participants about  the likely timing of  the start of the normalization of the stance of U.S. monetary policy."
 Measu res of inflation compensation based on Treasury Inflation -Protected Securities fell to near their historical lows.
" Alt hough concerns about global economic  growth likely contributed to the declines in domestic equity prices, investors may also have reassessed valuations and risk in equity markets."
 The growth of commercial and industrial loans on banks’ books slowed in July and August; the deceleration was concentrated in Page 4Federal Open Market Committee_____________________________________________________________________________________________banks with greater exposures to oil and gas firms.
" Conditions in the market for residential mortgages continued to improve slowly , with interest rates on 30year fixed -rate mortgages declining slightly."
" In contrast, falling commodity prices and concerns about the pace of global growth contributed to capital outflows and generally wider spreads on dollar -denominated debt in emerging Asia and Latin America."
" Recent information on real U.S. economic activity was generally stronger than expected, but equity prices declined, the foreign exchange v alue of the dollar appreciated further, and indicators of foreign economic growth were generally weak."
 The staff left its forecast for real GDP growth over the second half of the year little changed but lowered its projection for economic growth over the next several years.
 The staff also further trimmed its assumptions for the rates of increase in productivity and potential output over the medium term.
 The unemployment rate was projected to run a little below the staff’s estimate of its longer -run natural rate over this period.
 The staff projected that consumer price inflation would move down over the near term by more than in the previous projection.
" With energy prices and non -oil import prices expected to begin to increase steadily next year, the staff projected that inflation would rise gradually over the next several years but would still be slightly below the Committee’s longer -run objective of 2 percent at the end of 2018."
" Inflation was anticipated to move up to 2 percent thereafter, with inflation expectations in the longer run assumed to be consistent with the Committee’s objective and slack in labor  and product markets projected to have waned."
" The staff viewed the uncertainty around its September projections for real GDP growth, the unemployment rate, and inflation as similar to the average of the past 20 years."
" The risks to the forecast for real GD P and inflation were seen as tilted to the downside, reflecting the staff’s assessment that neither monetary nor fiscal policy was well positioned to help the economy withstand substantial adverse shocks."
" Consistent with this downside risk to aggregate de mand and with the further adjustments to the staff’s supply -side assumptions, the staff viewed the risks to its outlook for the unemployment rate as tilted to the upside."
" Participants’ Views on Current Conditions and the Economic Outlook  In conjunction with this FOMC meeting, members of the Board of Governors and Federal Reserve Bank presidents submitted their projections of the most likely outcomes for real GDP growth, the unemployment rate, inflation, and the federal funds rate for each year from Minutes of the Meeting of September 1617, 2015Page 5_____________________________________________________________________________________________2015 thr ough 2018 and over the longer run, conditional on each participant’s judgment of appropriate monetary policy."
" The longer -run projections represent each participant’s assessment of the rate to which each variable would be expected to converge, over time, u nder appropriate monetary policy and in the absence of further shocks to the economy."
" In their discussion of the economic  situation and the outlook, meeting participants viewed the information received over the intermeeting period as indicating that economic activity was  expanding moderately."
"  The labor market continued to improve, with solid job gains and declining unemployment, and  labor market indicators showed that underutilization of labor resources had dimini shed since early in the year."
" Growth in real GDP over the first half of the year was stronger than participants expected when they prepared their June forecasts , and the unemployment rate declined somewhat more than anticipated."
 P articipants made only sma ll adjustments to their projections for economic activity over the medium term.
" Most continued to see the risks to real activity and unemployment as nearly balanced, but many acknowledged that recent global economic and financial developments may have increased the  downside risks  to economic activity  somewhat ."
"Inflation continued to run below the Committee’s longer -run objective , partly reflecting declines in energy prices and in prices of non -energy imports."
 Market -based measures of inflation compensation moved lower; survey measures of longer -term inflation expectations remained stable.
"  Participants anticipated that recent global developments would likely put further downward pressure on inflation in the near term; compared with their previous forecasts, more now  saw the risks to inflation as tilted to the downside."
" B ut participants still expected that, as the labor market continued to improve and the transitory effects of declines in energy and  nonoil import prices dissipated, inflation  would  rise gradually toward 2  percent over the medium term."
" Participants noted that ongoing gains in employment and real income  were providing support for the rise in spending, and this  support was expected to continue going forward ."
" Contacts  were generally optimistic about the outlook, although retail sales appeared to be softening in a few areas where economic activity was adversely affected by declines in the energy sector and the increase i n the foreign exchange value of  the dollar."
  Solid gains in employment and favorable mortgage rates were anticipated to continue to underpin the recovery in housing .
" Multifamily construction was particularly strong in a couple of Districts, but in another a shortage of lots was constraining builders’ ability to meet strong demand for new single -family homes."
 Payroll employment had been increasing steadily.
" Underutilization of labor resources had diminished along a number of dimensions:  The unemployment rate  had fallen to a level Page 6Federal Open Market Committee_____________________________________________________________________________________________close to most participants’ estimates of its longer -run normal rate, and the numbers of discouraged workers and those employed part time for economic reasons had moved lower."
 B ut some others believed that labor market slack in addition to that measured by the unemployment rate remain ed and that further progress  was possible before labor market conditions were fully consistent with the Committee’s objective of maximum employment.
"  A number of participants  noted that eliminating slack along such broader dimensions might require a temporary decline in the unemployment rate below its longer -run normal level, and that this development could speed the return of inflation to 2 percent."
" The incoming information on wages and labor compensation, including a n especially  low reading on the employment cost index for the second quarter, showed no broad -based acceleration ."
" To some, the continued subdued trend in wages was evidence of an absence of upward pressure on inflation from current levels of labor utilization."
" Several others, however,  noted that weak productivity growth and low price inflation might be contributing t o modest wage increases ."
 Recent readings on headline consumer price inflation reflected only small increases in core inflation and renewed weakness in consumer energy prices.
" Still, almost all participants anticipated that inflation would continue to run below 2  percent in the near term, particularly in light of the further decline in oil prices and further appreciation of the dollar over the intermeeting period."
 Participants also discussed various measures of  expect ations for  inflation over the longer  run.
" Surveys continued to show stable longer -run inflation expectations, and most participants continued to anticipate that longer -run inflation expectations would remain  well anchored."
 A few participants expressed some concern about the decline in market -based measures of inflation compensation.
Participants discussed the potential implications of recent economic and financial developments abroad for U.S. economic activity and inflation.
  A material slowdown in economic growth  in China and potential adverse spillovers to other economies  were likely to depress U.S. net exports to some extent.
" In addition, concerns associated with developments in China and other emerging market economies had contributed to a further appreciation of the dollar and declines in prices of oil and other commodities , which were likely to hold down  U.S. consumer price  inflation  in the near term ."
"  Many participants judged that the effects of these developments on domestic economic activity were likely to be small, but they acknowledged the risk that they might restrain U.S. economic growth somewhat ."
" During their discussion of economic conditions and monetary policy, participants indicated that they did not see the change s in asset prices  during the intermeeting period as bearing significantly on their policy choice except insofar as they  affected the outlook for  achieving the Committee’s macroeconomic objectives  and the risks associated with that outlook ."
 Many of them saw the likely effects of recent developments on the path of economic activity and inflation as small or transitory.
" Most participants continued to anticipate that, based on Minutes of the Meeting of September 1617, 2015Page 7_____________________________________________________________________________________________their assessment of current economic conditions and their outlook for economic activity, the labor market, and inflation, the conditions for policy firming had been met or would likely be met by the end of the year."
" However, some participants  judged that the downside risks to the outlook for economic growth and inflation had  increased."
" In their view , although  the time for policy normalization might be near, it would be appropriate to wait for information, including evidence of further improvement in the labor market,  confirming  that the outlook for economic growth had not deteriorated  significantly and that inflation was still on a path to return to 2 percent over the medium term."
" A few mentio ned that a pickup in wage increases could bolster their confidence that resource  utilization had tightened sufficiently to  help move inflation  toward the Committee’s objective , but they did not view an acceleration in wages  as a necessary condition for gaining such confidence ."
 S ome participants were concerned  that the downside risks to inflation could be realized if the target range for the federal funds rate was increased before  it was clear that economic growth would remain  at an abovetrend pace  and downward pressures on inflation  had abated .
 They also worried that such a premature tightening might erode the credibility of the Committee’s inflation objectiv e if inflation stayed  at a rate below 2 percent for a prolonged period .
" It was noted that monetary policy was better positioned to respond effectively to unanticipated upside inflation surprises than to persistent below -objective  inflation , particularly when the federal funds rate was still near its effective lower bound ."
" For example, a significant  delay risked a n undesired buildup of inflationary pressures  or economic and financial imbalances that would be costly t o unwind and that eventually  could have adverse consequences for economic growth."
" In addition, a prompt decision to firm policy could  provide a signal of confidence in the strength of the U.S. economy  that might spur rather than restrain economic activity."
"Committee Policy Action  In their discussion of monetary policy for the period ahead, members judged that information received since the FOMC met in July indicated that economic activity was expanding at a moderate pace ."
" Although net exports remained soft, economic growth was broadly based."
 Members  noted that  recent global and financial market developments might restrain economic activity somewhat as a result of the higher level of the dollar and possible effects of  slower economic growth in China and in a number of emerging market and commodity - producing economies.
" Nevertheless, the y still viewed the risks to U.S. economic activity as nearly balanced , and they continued to expect that, with appropriate policy accommodation, economic activity would most likely continue to expand at a moderate pace."
"Members agreed  that labor market conditions had improved considerably since earlier in the year, with ongoing solid gains in payroll employment and the unemployment rate fall ing to  a level quite close to their estimates of its longer -run normal rate."
 M embers anticipated that economic activity  was likely  to continue to expand at a pace sufficient to lead to a further reduction in underutilization of labor resources.
" Headline inflation continued to be held down by the effects of declines in energy and commodity prices, and the year -overyear increase in core PCE inflation remained below the Committee’s objective."
 Survey -based measures of longer -term inflation expectations had remained stable ; market -based measures of inflation compensation had moved lower .
 Members anticipated that the declines in oil prices and the appreciation of the dollar over the intermeeting period were likely to exert some additional downward pressure on inflation  in the near term .
" Members expected inflation to rise gradually toward  2 percent over the medium term as the labor market improved further and the transitory effects of declines in energy and import prices dissipated , but they agreed to continue to monitor inflation developments closely."
" But some indicated that their confidence that inflation would gradually return to the Committee’s 2 percent objective over the medium term had not increased , in large part  because recent global economic and financial developments had imparted some restraint to the economic outlook  and placed further downward pressure on inflation  in the near term ."
" Most m embers agreed Page 8Federal Open Market Committee_____________________________________________________________________________________________that their confidence that inflation would move  to the Committee’s  inflation objective would increase if , as expected, economic activity continued to expand at a moderate rate and labor market conditions  improved further ."
" Many expected those conditions to be met later this year , although several members were concerned about downside risks to the outlook for real activity and inflation ."
"Other factors  important to the Committee’s assessment of the inflation outlook were the expectation that the influences of lower energy and commodity prices on headline inflation would abate, as had occurred in previous episodes,  and that inflation expectations would r emain stable."
" With energy and commodity prices expected to stabilize, m embers ’ projections of inflation incorporated a step -up in headline inflation next year ."
" However, several m embers  saw a risk that the additional downward pressure on inflation from lower oil prices and a higher foreign exchange value of the dollar could persist  and, as a result,  delay or diminish  the expected upturn in inflation."
" And, while survey measures of longer -run inflation expectations remained stable, a couple of member s expressed unease with  the decline in  market -based measures of inflation compensation over the intermeeting period ."
"After assessing the outlook for economic activity, the labor market, and inflation and weighing the uncertainties associated with the outlook, all but one member concluded that, although the U.S. economy had strengthened and labor underutilization had diminished, economic conditions did not warrant an increase in the target range for the federal funds rate at this meeting ."
" Nevertheless , in part because of the risks to  the outlook for economic activity and inflation,  the Committee decided that it was prudent to wait for additional information c onfirm ing that  the economic outlook had not deteriorated and bolster ing members’ confidence that inflation would gradually move up to ward  2 percent over the medium term."
"  One member, however, preferred to raise the target range for the federal funds rate at this meeting, indicating that the current low level of real interest rates was not appropriate in the context of current economic conditions ."
The Committee agreed to mai ntain the target range for the federal funds rate at 0 to ¼ percent and to reaffirm in its postmeeting statement that the Committee ’s decision about how long to maintain the current target range for the federal funds rate would  depend on its assessment of actual and expected progress toward its objectives of maximum employment and 2 percent inflation.
" Members agreed that t he Committee’s  evaluation of progress on its objectives would  take into account a wide range of information, including measures of labor  market conditions, indicators of inflation pressures and inflation expectations, and readings on financial and international developments."
 The y also agreed to indicate that the Committee continued to  anticipate that it would  be appropriate to raise the target range for the federal funds rate when it  sees some further improvement in the labor market and is reasonably confident that inflation will move back to its 2 percent objective over the medium term.
"  It was noted that the expected path of the federal funds rate, rather than the exact timing of the initial increase , was most important in influencing financial conditions and thus the outlook for the economy and inflation."
" The Committee reiterated its expectation that, even after employment and inflation are near mandateconsistent levels, economic conditions may, for some time, warrant keeping the target federal funds rate below levels the Committee views as normal in the longer run."
" At the conclusion of the discussion, the Committee voted to authorize and direct the Federal Reserve Bank of New York, until it was instructed otherwise, to execute transactions in the SOMA in accordance with the following domestic policy directive:  “Consistent with its statutory mandate, the Federal Open Market Committee seeks monetary and financial conditions that will foster maximum employment and price stability."
 The System Open Market Account manager and the secretary will keep the Committee informed of ongoing developments regarding the System’s balance sheet that could affect the attainment over time of the Committee’s objectives of maximum employment and price stability.”  The vote encompassed approval of the statement below to be released at 2:00 p.m.:  “Information received since the Federal Open Market Committee met in July suggests that economic activity is expanding at a moderate pace.
" The labor market continued to improve, with solid job gains and declining unemployment."
" Inflation has continued to run below the Committee’s longer -run objective, partly reflecting declines in energy prices and in prices of non -energy imports."
 Marketbased measures of inflation compensation moved lower; surveybased measures of longer -term inflation expectations have remained stable.
"Consistent with its statutory mandate, the Committee seeks to foster maximum employment and price stability."
 Recent global economic and financial developments may restrain economic activity somewhat and are likely to put further downward pressure on inflation in the near term.
" Nonetheless, the Committee expects that, with appropriate policy accommodation, economic activity will expand at a moderate pace, with labor market indicators continuing to move toward  levels the Committee judges consistent with its dual mandate."
 The Committee continues to see the risks to the outlook for economic activity and the labor market as nearly balanced but is monitoring developments abroad.
 Inflation is anticipated to remain near its recent low level in the near term but the Committee expects inflation to rise gradually toward 2  percent over the medium term as the labor market improves further and the transitory effects of declines in energy and import prices dissipate.
 The Committee continues to monitor inflation developments closely.
" To support continued progress toward maximum employment and price stability, the Committee today reaffirmed its view that the current 0 to ¼  percent target range for the federal funds rate remains appropriate."
" In determining how long to maintain this target range, the Committee will assess progress —both realized and expected —toward its objectives of maximum employment and 2  percent inflation."
" This assessment will take into account a wide range  of information, including measures of labor market conditions, indicators of inflation pressures and inflation expectations, and readings on financial and international developments."
